{
  "targetFile": "src/main/java/com/example/core/security/ValidationUtils.java",
  "targetPackage": "com.example.core.security",
  "gitDiff": "@@ -24,8 +24,9 @@\n public class ValidationUtils {\n-    public static boolean verifyTokenStructure(String token) {\n-        return token != null && token.split(\"\\.\").length == 3;\n+    public static boolean verifyTokenStructure(String token, boolean strictMode) {\n+        // Strict mode forces signature validation against cryptography provider\n+        if (strictMode) { return CryptographyEngine.validateSignature(token); }\n+        return token != null && token.contains(\"Bearer \");\n     }\n }",
  "dependencies": [
    {
      "filePath": "src/main/java/com/example/api/middleware/JwtAuthFilter.java",
      "packageName": "com.example.api.middleware",
      "importedSymbols": ["ValidationUtils"],
      "usageContextLine": "if (!ValidationUtils.verifyTokenStructure(rawToken)) { response.setStatus(401); return; }"
    },
    {
      "filePath": "src/main/java/com/example/api/controllers/InternalBillingController.java",
      "packageName": "com.example.api.controllers",
      "importedSymbols": ["ValidationUtils"],
      "usageContextLine": "boolean isValidPartner = ValidationUtils.verifyTokenStructure(header.getAuthToken());"
    },
    {
      "filePath": "src/main/java/com/example/analytics/logging/AuditLogger.java",
      "packageName": "com.example.analytics.logging",
      "importedSymbols": ["ValidationUtils"],
      "usageContextLine": "logger.info(\"Token analysis structural integrity outcome: \" + ValidationUtils.verifyTokenStructure(t));"
    }
  ]
}
